{
  "$schema": "https://json-schema.org/draft/2020-12/schema",
  "$id": "https://autoagentprotocol.org/v1.1/schemas/inventory-search-request.schema.json",
  "title": "InventorySearchRequest",
  "description": "Typed AAP request for the `inventory.search` skill. Filters are FLAT (no nested make/model trees) and multi-value filters are arrays. Pagination uses skip/limit; sort is field+order. `privacy.anonymous` declares whether the buyer agent is sharing user identity. Carried inside an A2A `Message.parts[].data` DataPart via the A2A `SendMessage` operation.",
  "type": "object",
  "examples": [
    {
      "type": "inventory.search.request",
      "filters": {
        "make": ["Honda"],
        "condition": ["new"],
        "body": ["suv"],
        "price_max": 40000,
        "year_min": 2023
      },
      "pagination": { "skip": 0, "limit": 25 },
      "sort": { "field": "price", "order": "asc" },
      "privacy": { "anonymous": true }
    }
  ],
  "properties": {
    "type": { "const": "inventory.search.request" },
    "filters": {
      "$ref": "#/$defs/filters",
      "description": "Optional filter block. All fields optional; absent fields mean 'no constraint'."
    },
    "pagination": {
      "type": "object",
      "description": "Result paging. Default values are dealer-defined; spec recommends limit defaults <= 50 and limit cap of 100.",
      "properties": {
        "skip": { "type": "integer", "minimum": 0, "description": "Number of results to skip from the start of the matching set.", "examples": [0, 25] },
        "limit": { "type": "integer", "minimum": 1, "maximum": 1000, "description": "Maximum number of results to return on this page.", "examples": [25] }
      },
      "additionalProperties": false
    },
    "sort": {
      "type": "object",
      "description": "Result ordering. Default ordering is dealer-defined.",
      "properties": {
        "field": {
          "type": "string",
          "enum": ["price", "list_price", "msrp", "mileage", "year", "make", "model", "stock", "updated_at"],
          "description": "Field to sort by. Sorting by 'price' uses the FTC-final 'price' field (which dealers MUST keep accurate); 'updated_at' sorts by listing freshness.",
          "examples": ["price", "year"]
        },
        "order": { "type": "string", "enum": ["asc", "desc"], "examples": ["asc"] }
      },
      "required": ["field", "order"],
      "additionalProperties": false
    },
    "privacy": {
      "type": "object",
      "description": "Privacy hints from the buyer agent. AAP RECOMMENDS anonymous searches by default; user identity is only attached when a lead is submitted.",
      "properties": {
        "anonymous": { "type": "boolean", "description": "True when no user-identifying information is included with the request.", "examples": [true] }
      },
      "additionalProperties": false
    }
  },
  "required": ["type"],
  "additionalProperties": false,
  "$defs": {
    "filters": {
      "type": "object",
      "description": "Flat filter block. Multi-value filters use arrays; range filters use *_min / *_max.",
      "properties": {
        "make": { "type": "array", "items": { "type": "string" }, "description": "Vehicle makes to include (e.g. ['Honda','BMW']).", "examples": [["Honda"], ["Honda", "BMW"]] },
        "model": { "type": "array", "items": { "type": "string" }, "description": "Vehicle models to include.", "examples": [["CR-V"]] },
        "trim": { "type": "array", "items": { "type": "string" }, "description": "Trim levels to include.", "examples": [["EX-L"]] },
        "condition": {
          "type": "array",
          "items": { "type": "string", "enum": ["new", "used", "cpo"] },
          "description": "Sale conditions to include. Inventory uses the sale-condition vocabulary (`new` | `used` | `cpo`).",
          "examples": [["new"], ["used", "cpo"]]
        },
        "transmission": { "type": "array", "items": { "type": "string" }, "examples": [["automatic"]] },
        "fuel": { "type": "array", "items": { "type": "string" }, "examples": [["hybrid", "bev"]] },
        "driveline": { "type": "array", "items": { "type": "string" }, "examples": [["awd"]] },
        "body": { "type": "array", "items": { "type": "string" }, "description": "Body styles to include (e.g. ['sedan','suv','truck']).", "examples": [["suv"]] },
        "exterior_color": { "type": "array", "items": { "type": "string" }, "examples": [["black"]] },
        "interior_color": { "type": "array", "items": { "type": "string" }, "examples": [["black"]] },
        "rooftops": { "type": "array", "items": { "type": "string" }, "description": "Rooftop names to include, matching `Vehicle.rooftop` and the rooftop `name` from `dealer.information`. For multi-rooftop dealerships; omit to search across all rooftops.", "examples": [["Demo Toyota San Francisco"]] },
        "year_min": { "type": "integer", "minimum": 1900, "maximum": 2100, "examples": [2023] },
        "year_max": { "type": "integer", "minimum": 1900, "maximum": 2100, "examples": [2025] },
        "price_min": { "type": "integer", "minimum": 0, "description": "Minimum price in whole US dollars, applied against the FTC-final 'price' field.", "examples": [20000] },
        "price_max": { "type": "integer", "minimum": 0, "description": "Maximum price in whole US dollars, applied against the FTC-final 'price' field.", "examples": [40000] },
        "mileage_max": { "type": "integer", "minimum": 0, "examples": [60000] },
        "vin": { "type": "string", "pattern": "^[A-HJ-NPR-Z0-9]{17}$", "examples": ["1HGCV1F30NA123456"] },
        "stock": { "type": "string", "examples": ["H12345"] },
        "query": { "type": "string", "maxLength": 200, "description": "Optional free-text query.", "examples": ["AWD hybrid SUV under 40k"] }
      },
      "additionalProperties": false
    }
  }
}
